<?xml version="1.0" encoding="utf-8"?>
<xs:schema targetNamespace="http://tempuri.org/XMLSchema.xsd"
    elementFormDefault="qualified"
    xmlns="http://tempuri.org/XMLSchema.xsd"
    xmlns:mstns="http://tempuri.org/XMLSchema.xsd"
    xmlns:xs="http://www.w3.org/2001/XMLSchema"
>

  <xs:element name="actions">
    <xs:complexType>
      <xs:sequence>
        <xs:element maxOccurs="unbounded" name="action">
          <xs:complexType>
            <xs:sequence>
              <xs:element name="id" type="xs:int" />
              <xs:element name="name" type="xs:string" />
              <xs:element name="description" type="xs:string" />
              <xs:element name="methodname" type="xs:string" />
            </xs:sequence>
          </xs:complexType>
        </xs:element>
      </xs:sequence>
    </xs:complexType>
    <xs:unique name="uniqueID">
      <xs:selector xpath="action" />
      <xs:field xpath="id" />
    </xs:unique>
  </xs:element>
</xs:schema>
